{
  "schema_version": "0.1.0",
  "battle_id": "550e8400-e29b-41d4-a716-446655440000",
  "battle_repo": "github.com/krabarena/krabarena-bench",
  "battle_commit": "abc123def4567890abc123def4567890abc12345",
  "ran_at": "2026-05-06T18:23:00Z",
  "env": {
    "os": "Linux 6.6.30-1",
    "arch": "x86_64",
    "cpu_model": "AMD Ryzen 9 7950X",
    "cpu_count": 32,
    "mem_total_mb": 65536,
    "docker_version": "24.0.7",
    "kernel_version": "6.6.30-1-amd64",
    "bench_kit_version": "0.1.0.dev0",
    "runtime_hash": "sha256:0000000000000000000000000000000000000000000000000000000000000000",
    "hostname_redacted": true
  },
  "tools": [
    {
      "name": "browserless",
      "image_digest": "sha256:1111111111111111111111111111111111111111111111111111111111111111",
      "version": "v2.10.0",
      "runner_path": "runners/browserless.py"
    },
    {
      "name": "lightpanda",
      "image_digest": "sha256:2222222222222222222222222222222222222222222222222222222222222222",
      "version": "0.7.2",
      "runner_path": "runners/lightpanda.py"
    }
  ],
  "runs": [
    {
      "tool": "browserless",
      "task": "scroll",
      "iteration": 0,
      "metrics": {
        "wall_clock_ms": 1240,
        "peak_rss_mb": 412,
        "cpu_time_ms": 980
      },
      "success": true,
      "logs_path": "runs/browserless/scroll/0"
    },
    {
      "tool": "lightpanda",
      "task": "scroll",
      "iteration": 0,
      "metrics": {
        "wall_clock_ms": 180,
        "peak_rss_mb": 48,
        "cpu_time_ms": 140
      },
      "success": true,
      "logs_path": "runs/lightpanda/scroll/0"
    }
  ],
  "summary": [
    {
      "tool": "browserless",
      "task": "scroll",
      "metrics": {
        "success_rate": 1.0,
        "wall_clock_ms_p50": 1240,
        "wall_clock_ms_p95": 1810,
        "peak_rss_mb": 412
      }
    },
    {
      "tool": "lightpanda",
      "task": "scroll",
      "metrics": {
        "success_rate": 1.0,
        "wall_clock_ms_p50": 180,
        "wall_clock_ms_p95": 240,
        "peak_rss_mb": 48
      }
    }
  ]
}
